{"catalog":{"digest":"sha256:0ecbda1584b1baa0cf8ada2c38fc6c2037b7f2f8334c34b33f682a0ae9e28d07","version":"1.0.1"},"cleanup":[],"entry":"step-0001","environment":{"application":"EDRClient.exe","backend":"windows_pywinauto","profile":"windows_hisec","target":"target"},"name":"hisec-logcenter","schema":"edr.desktop-golden-trace/v1","sourceRecording":{"schema":"edr.desktop-recording/v1","sha256":"sha256:93ec9c15d9159d3582559c28f570311725ae1edca3f0fd7a3f1c3b91b10026f5"},"status":"ready","steps":{"step-0001":{"actionId":"gui.click","args":{},"endSelector":null,"issues":[],"next":"step-0002","required":true,"selector":{"control":{"ancestry":[{"automationId":"EdrMainWindow.baseWidget.pageWidget.mainPage","controlType":"Group"},{"automationId":"EdrMainWindow.baseWidget.pageWidget","controlType":"Custom"},{"automationId":"EdrMainWindow.baseWidget","controlType":"Group"},{"automationId":"EdrMainWindow","controlType":"Window","name":"logo1"},{"controlType":"Pane","name":"Desktop 1"}],"automationId":"EdrMainWindow.baseWidget.pageWidget.mainPage.contentWidget","controlType":"Group","fingerprint":"sha256:39d8e0c851fc03df5e0632c897c864d70fb6ba450562d32e95f4390954a366cd"},"visual":null,"window":{"processName":"EDRClient.exe","titleRegex":"^logo1$"}},"status":"ready","stepId":"step-0001","verifiers":[]},"step-0002":{"actionId":"gui.click","args":{},"endSelector":null,"issues":[],"next":null,"required":true,"selector":{"control":{"ancestry":[{"automationId":"EdrMainWindow.baseWidget.pageWidget.mainPage.contentWidget.mainWidget.operationWidget","controlType":"Group"},{"automationId":"EdrMainWindow.baseWidget.pageWidget.mainPage.contentWidget.mainWidget","controlType":"Group"},{"automationId":"EdrMainWindow.baseWidget.pageWidget.mainPage.contentWidget","controlType":"Group"},{"automationId":"EdrMainWindow.baseWidget.pageWidget.mainPage","controlType":"Group"},{"automationId":"EdrMainWindow.baseWidget.pageWidget","controlType":"Custom"},{"automationId":"EdrMainWindow.baseWidget","controlType":"Group"}],"automationId":"EdrMainWindow.baseWidget.pageWidget.mainPage.contentWidget.mainWidget.operationWidget.logCenterBtn","controlType":"Button","fingerprint":"sha256:be58802a43a112b38422af7a12afbb3be41484295cb553f26cb09aeae009691e","name":"日志中心"},"visual":{"contextSha256":"sha256:8dae29ce8d2a355ac86608b887e2757b274ec8524296716392f67db5aff51ac5","contextTemplate":"assets/step-0002-context.png","elementSha256":"sha256:ab0d9da563ca01f68a109350560b9dda97caded6b9ed3129ee2a217811590e44","redacted":true,"relativePoint":[0.5,0.5],"template":"assets/step-0002-element.png"},"window":{"processName":"EDRClient.exe","titleRegex":"^logo1$"}},"status":"ready","stepId":"step-0002","verifiers":[{"expected":{"exists":true,"processName":"EDRClient.exe","title":"日志中心"},"timeoutSeconds":5.0,"type":"window_open"},{"expected":{"exists":true,"processName":"EDRClient.exe","title":"EDRClient"},"timeoutSeconds":6.2,"type":"window_open"},{"expected":{"exists":true,"processName":"EDRClient.exe"},"timeoutSeconds":6.2,"type":"window_open"},{"expected":{"exists":false,"processName":"EDRClient.exe","title":"EDRClient"},"timeoutSeconds":7.7,"type":"window_open"},{"expected":{"exists":false,"processName":"EDRClient.exe"},"timeoutSeconds":7.7,"type":"window_open"}]}}}
